id,text,answer1,answer2,answer3,answer4,correctAnswer
1,"Эй, засранец! Не смей катить баллоны на группу…",1) Spice Girls,2) Time,3) Bon Jovi,4) The Beatles,2
2,"Что написано на майке владельца магазина, возле которого фарцуют Джей и Боб?",1) Ленин жив!,2) СССР,3) God Bless America,4) Я из Нью-Йорка,2
3,Сейчас будет очень легко! По мотивам комикса снимают фильм про Джея и Молчаливого Боба. А какое название у комикса?,1) Румер и Соник,2) Грабер и Нолик,3) Пыхарь и Хроник,4) Нюхарь и Тоник,3
4,"Съемки фильма начинаются в эту пятницу, а сегодня вторник. Сколько осталось до съемок, по мнению Джея?",1) Всего один день!,2) Два дня!,3) Восемь дней!,4) Две недели,3
5,И какое задание должен выполнить Джей?,1) Стырить бронзовай браслет,2) Стырить обезьяну,3) Стырить кепку Кевина Спейси,4) Стырить пять пачек чипсов,2
6,"Какое слово Боб произнес первым в фильме? А что, думали всегда будет легко?",1) Орангутан!,2) Засранец!,3) Багажник!,4) Любовь!,3
7,На съемки какого фильма впервые попадают Джей и Боб в Голливуде?,1) Умница Уил Хантинг - 2,2) Перл-Харбор,3) Ганнибал,4) Игры разума,1
8,Ну и последний вопрос. Какая американская кинокомпания снимает фильм про Джея и Боба?,1) Warner Bros. Pictures,2) 20th Century Fox,3) Miramax Films,4) Paramount Pictures,3